{
  "schema_version": 1,
  "last_reviewed": "2026-08-18",
  "categories": [
    {
      "id": "flashcards-spaced-repetition",
      "name": "Flashcards & Spaced Repetition",
      "emoji": "🃏"
    },
    {
      "id": "note-taking-knowledge-management",
      "name": "Note-Taking & Knowledge Management",
      "emoji": "📝"
    },
    {
      "id": "ai-tutors-homework-help",
      "name": "AI Tutors & Homework Help",
      "emoji": "🤖"
    },
    {
      "id": "math-stem",
      "name": "Math & STEM",
      "emoji": "🔬"
    },
    {
      "id": "language-learning",
      "name": "Language Learning",
      "emoji": "🗣️"
    },
    {
      "id": "focus-productivity-study-planning",
      "name": "Focus, Productivity & Study Planning",
      "emoji": "⏱️"
    },
    {
      "id": "research-reading-writing",
      "name": "Research, Reading & Writing",
      "emoji": "📖"
    },
    {
      "id": "course-platforms-video-learning",
      "name": "Course Platforms & Video Learning",
      "emoji": "🎓"
    },
    {
      "id": "test-prep",
      "name": "Test Prep (Global)",
      "emoji": "📋"
    },
    {
      "id": "collaboration-tutoring",
      "name": "Collaboration & Tutoring Marketplaces",
      "emoji": "👥"
    },
    {
      "id": "lecture-document-ai",
      "name": "Lecture & Document AI",
      "emoji": "🎙️"
    }
  ],
  "regions": [
    {
      "id": "united-states-canada",
      "name": "United States & Canada",
      "emoji": "🇺🇸🇨🇦"
    },
    {
      "id": "united-kingdom-ireland",
      "name": "United Kingdom & Ireland",
      "emoji": "🇬🇧🇮🇪"
    },
    {
      "id": "continental-europe",
      "name": "Continental Europe",
      "emoji": "🇪🇺"
    },
    {
      "id": "india",
      "name": "India",
      "emoji": "🇮🇳"
    },
    {
      "id": "china",
      "name": "China",
      "emoji": "🇨🇳"
    },
    {
      "id": "japan",
      "name": "Japan",
      "emoji": "🇯🇵"
    },
    {
      "id": "south-korea",
      "name": "South Korea",
      "emoji": "🇰🇷"
    },
    {
      "id": "southeast-asia",
      "name": "Southeast Asia",
      "emoji": "🌏"
    },
    {
      "id": "middle-east-north-africa",
      "name": "Middle East & North Africa",
      "emoji": "🕌"
    },
    {
      "id": "latin-america",
      "name": "Latin America",
      "emoji": "🌎"
    },
    {
      "id": "sub-saharan-africa",
      "name": "Africa (Sub-Saharan)",
      "emoji": "🌍"
    },
    {
      "id": "australia-new-zealand",
      "name": "Australia & New Zealand",
      "emoji": "🇦🇺🇳🇿"
    }
  ],
  "tools": [
    {
      "id": "3blue1brown",
      "name": "3Blue1Brown",
      "url": "https://www.3blue1brown.com/",
      "description": "Visual explanations of mathematics through animated videos.",
      "categories": [
        "math-stem",
        "course-platforms-video-learning"
      ],
      "regions": [],
      "countries": [],
      "ai_role": "none",
      "access": "free",
      "platforms": [
        "YouTube"
      ],
      "status": "active",
      "maintainer_affiliated": false,
      "last_reviewed": "2026-08-18"
    },
    {
      "id": "abwaab",
      "name": "Abwaab",
      "url": "https://www.abwaab.com/",
      "description": "Curriculum-aligned video lessons and practice for learners in Jordan, Egypt, and Pakistan.",
      "categories": [
        "course-platforms-video-learning"
      ],
      "regions": [
        "middle-east-north-africa"
      ],
      "countries": [
        "Jordan"
      ],
      "ai_role": "features",
      "access": "freemium",
      "platforms": [
        "Web"
      ],
      "status": "active",
      "maintainer_affiliated": false,
      "last_reviewed": "2026-08-18"
    },
    {
      "id": "adobe-acrobat-ai-assistant",
      "name": "Adobe Acrobat AI Assistant",
      "url": "https://www.adobe.com/acrobat/generative-ai-pdf.html",
      "description": "Ask questions and get summaries from PDFs inside Acrobat.",
      "categories": [
        "lecture-document-ai"
      ],
      "regions": [],
      "countries": [],
      "ai_role": "native",
      "access": "paid",
      "platforms": [
        "Multiple platforms"
      ],
      "status": "active",
      "maintainer_affiliated": false,
      "last_reviewed": "2026-08-18"
    },
    {
      "id": "alef-education",
      "name": "Alef Education",
      "url": "https://www.alefeducation.com/",
      "description": "Arabic-first adaptive K–12 learning platform for schools and individual learners.",
      "categories": [
        "course-platforms-video-learning"
      ],
      "regions": [
        "middle-east-north-africa"
      ],
      "countries": [
        "UAE"
      ],
      "ai_role": "native",
      "access": "institutional",
      "platforms": [
        "Web"
      ],
      "status": "active",
      "maintainer_affiliated": false,
      "last_reviewed": "2026-08-18"
    },
    {
      "id": "allen",
      "name": "Allen",
      "url": "https://allen.in/",
      "description": "Online and classroom-based preparation for Indian entrance and government examinations.",
      "categories": [
        "test-prep"
      ],
      "regions": [
        "india"
      ],
      "countries": [],
      "ai_role": "features",
      "access": "paid",
      "platforms": [
        "Web"
      ],
      "status": "active",
      "maintainer_affiliated": false,
      "last_reviewed": "2026-08-18"
    },
    {
      "id": "almentor",
      "name": "Almentor",
      "url": "https://www.almentor.net/home",
      "description": "Arabic-language courses in professional and personal development.",
      "categories": [
        "course-platforms-video-learning"
      ],
      "regions": [
        "middle-east-north-africa"
      ],
      "countries": [
        "Egypt",
        "UAE"
      ],
      "ai_role": "none",
      "access": "pay-as-you-go",
      "platforms": [
        "Web"
      ],
      "status": "active",
      "maintainer_affiliated": false,
      "last_reviewed": "2026-08-18"
    },
    {
      "id": "alura",
      "name": "Alura",
      "url": "https://www.alura.com.br/",
      "description": "Portuguese-language technology and professional-skills courses.",
      "categories": [
        "course-platforms-video-learning"
      ],
      "regions": [
        "latin-america"
      ],
      "countries": [
        "Brazil"
      ],
      "ai_role": "features",
      "access": "paid",
      "platforms": [
        "Web"
      ],
      "status": "active",
      "maintainer_affiliated": false,
      "last_reviewed": "2026-08-18"
    },
    {
      "id": "amboss",
      "name": "AMBOSS",
      "url": "https://www.amboss.com/int",
      "description": "Medical Qbank + library for USMLE and med school.",
      "categories": [
        "test-prep"
      ],
      "regions": [],
      "countries": [],
      "ai_role": "features",
      "access": "paid",
      "platforms": [
        "Web",
        "iOS",
        "Android"
      ],
      "status": "active",
      "maintainer_affiliated": false,
      "last_reviewed": "2026-08-18"
    },
    {
      "id": "anki",
      "name": "Anki",
      "url": "https://apps.ankiweb.net/",
      "description": "An open-source spaced-repetition system with a large community deck library.",
      "categories": [
        "flashcards-spaced-repetition",
        "language-learning"
      ],
      "regions": [
        "japan"
      ],
      "countries": [],
      "ai_role": "none",
      "access": "free",
      "platforms": [
        "Windows",
        "macOS",
        "Linux",
        "iOS",
        "Android",
        "Web"
      ],
      "status": "active",
      "maintainer_affiliated": false,
      "last_reviewed": "2026-08-18"
    },
    {
      "id": "anton",
      "name": "ANTON",
      "url": "https://anton.app/",
      "description": "Free gamified learning for primary and lower-secondary, aligned to German state curricula.",
      "categories": [
        "course-platforms-video-learning"
      ],
      "regions": [
        "continental-europe"
      ],
      "countries": [
        "Germany"
      ],
      "ai_role": "none",
      "access": "free",
      "platforms": [
        "Web"
      ],
      "status": "active",
      "maintainer_affiliated": false,
      "last_reviewed": "2026-08-18"
    },
    {
      "id": "aprende-institute",
      "name": "Aprende Institute",
      "url": "https://aprende.com/",
      "description": "Vocational training for Spanish-speaking learners and workforce.",
      "categories": [
        "course-platforms-video-learning"
      ],
      "regions": [
        "latin-america"
      ],
      "countries": [
        "LatAm"
      ],
      "ai_role": "features",
      "access": "paid",
      "platforms": [
        "Web"
      ],
      "status": "active",
      "maintainer_affiliated": false,
      "last_reviewed": "2026-08-18"
    },
    {
      "id": "atama",
      "name": "atama+",
      "url": "https://www.atama.plus/",
      "description": "AI-adaptive university entrance prep that diagnoses root-cause knowledge gaps (cram schools).",
      "categories": [
        "test-prep"
      ],
      "regions": [
        "japan"
      ],
      "countries": [],
      "ai_role": "native",
      "access": "institutional",
      "platforms": [
        "Web"
      ],
      "status": "active",
      "maintainer_affiliated": false,
      "last_reviewed": "2026-08-18"
    },
    {
      "id": "atar-notes",
      "name": "ATAR Notes",
      "url": "https://atarnotes.com/",
      "description": "Peer-driven notes and practice exams written by recent top scorers (VCE/HSC/QCE/WACE).",
      "categories": [
        "test-prep"
      ],
      "regions": [
        "australia-new-zealand"
      ],
      "countries": [],
      "ai_role": "none",
      "access": "freemium",
      "platforms": [
        "Web"
      ],
      "status": "active",
      "maintainer_affiliated": false,
      "last_reviewed": "2026-08-18"
    },
    {
      "id": "atomi",
      "name": "Atomi",